{
  "$schema": "https://json-schema.org/draft/2020-12/schema",
  "$id": "https://kartos/nuclide-table.schema.json",
  "title": "Nuclide Table (Build a Nucleus data asset)",
  "description": "Nuclide stability / half-life / decay-mode lookup data ported from PhET shred (Relational ENSDF, 2022) plus element symbols and English names from shred AtomNameUtils. Generated by scripts/extract_nuclide_data.mjs; do not hand-edit.",
  "type": "object",
  "required": ["version", "source", "elements", "stableNeutrons", "halfLives", "decays", "electronCloudRadii"],
  "properties": {
    "version": { "type": "string" },
    "source": {
      "type": "object",
      "required": ["description", "files", "retrievedAt", "license"],
      "properties": {
        "description": { "type": "string" },
        "files": {
          "type": "array",
          "items": { "type": "string", "format": "uri" },
          "minItems": 1
        },
        "retrievedAt": { "type": "string" },
        "license": { "type": "string" }
      }
    },
    "elements": {
      "type": "array",
      "description": "Index = atomic number Z. Entry 0 is the 'no element' placeholder (empty symbol/name).",
      "minItems": 2,
      "items": {
        "type": "object",
        "required": ["z", "symbol", "name"],
        "properties": {
          "z": { "type": "integer", "minimum": 0 },
          "symbol": { "type": "string" },
          "name": { "type": "string", "description": "Capitalized English element name; '' for z = 0. Localization is handled outside this table." }
        }
      }
    },
    "stableNeutrons": {
      "type": "array",
      "description": "Array index = proton number Z; each entry lists the neutron numbers N of stable isotopes (shred stableElementTable).",
      "items": {
        "type": "array",
        "items": { "type": "integer", "minimum": 0 },
        "uniqueItems": true
      }
    },
    "halfLives": {
      "type": "object",
      "description": "Half-life in seconds. Key 'Z' -> key 'N' -> seconds; null = nuclide exists but half-life unknown; a missing key means no data for that nuclide (shred HalfLifeConstants).",
      "additionalProperties": {
        "type": "object",
        "additionalProperties": { "type": ["number", "null"], "exclusiveMinimum": 0 }
      }
    },
    "decays": {
      "type": "object",
      "description": "Decay modes. Key 'Z' -> key 'N' -> (ENSDF decay string -> branch percent) or null (nuclide exists but decay modes unknown). ENSDF keys are kept raw (e.g. 'B-', 'EC+B+', 'A', 'P', '2N'); mapping to the 5 simulation decay types lives in Dart NuclideRepository, mirroring shred AtomInfoUtils.",
      "additionalProperties": {
        "type": "object",
        "additionalProperties": {
          "type": ["object", "null"],
          "additionalProperties": { "type": ["number", "null"], "minimum": 0, "maximum": 100 }
        }
      }
    },
    "electronCloudRadii": {
      "type": "object",
      "description": "Electron cloud radius per electron count (= proton number Z for the neutral atom). Visual aid data based on experimental atomic radii, tuned by PhET (shred mapElectronCountToRadius).",
      "additionalProperties": { "type": "number", "exclusiveMinimum": 0 }
    }
  }
}
