{"version":"1.0.0","source":{"description":"Nuclide stability / half-life / decay-mode data ported from PhET shred (Relational ENSDF, 2022). Element symbols and English names from shred AtomNameUtils.","files":["https://github.com/phetsims/shred/blob/main/js/AtomData.ts","https://github.com/phetsims/shred/blob/main/js/AtomNameUtils.ts"],"retrievedAt":"2026-08-28","license":"GPL-3.0 (PhET Interactive Simulations, University of Colorado Boulder)"},"elements":[{"z":0,"symbol":"-","name":""},{"z":1,"symbol":"H","name":"Hydrogen"},{"z":2,"symbol":"He","name":"Helium"},{"z":3,"symbol":"Li","name":"Lithium"},{"z":4,"symbol":"Be","name":"Beryllium"},{"z":5,"symbol":"B","name":"Boron"},{"z":6,"symbol":"C","name":"Carbon"},{"z":7,"symbol":"N","name":"Nitrogen"},{"z":8,"symbol":"O","name":"Oxygen"},{"z":9,"symbol":"F","name":"Fluorine"},{"z":10,"symbol":"Ne","name":"Neon"},{"z":11,"symbol":"Na","name":"Sodium"},{"z":12,"symbol":"Mg","name":"Magnesium"},{"z":13,"symbol":"Al","name":"Aluminum"},{"z":14,"symbol":"Si","name":"Silicon"},{"z":15,"symbol":"P","name":"Phosphorus"},{"z":16,"symbol":"S","name":"Sulfur"},{"z":17,"symbol":"Cl","name":"Chlorine"},{"z":18,"symbol":"Ar","name":"Argon"},{"z":19,"symbol":"K","name":"Potassium"},{"z":20,"symbol":"Ca","name":"Calcium"},{"z":21,"symbol":"Sc","name":"Scandium"},{"z":22,"symbol":"Ti","name":"Titanium"},{"z":23,"symbol":"V","name":"Vanadium"},{"z":24,"symbol":"Cr","name":"Chromium"},{"z":25,"symbol":"Mn","name":"Manganese"},{"z":26,"symbol":"Fe","name":"Iron"},{"z":27,"symbol":"Co","name":"Cobalt"},{"z":28,"symbol":"Ni","name":"Nickel"},{"z":29,"symbol":"Cu","name":"Copper"},{"z":30,"symbol":"Zn","name":"Zinc"},{"z":31,"symbol":"Ga","name":"Gallium"},{"z":32,"symbol":"Ge","name":"Germanium"},{"z":33,"symbol":"As","name":"Arsenic"},{"z":34,"symbol":"Se","name":"Selenium"},{"z":35,"symbol":"Br","name":"Bromine"},{"z":36,"symbol":"Kr","name":"Krypton"},{"z":37,"symbol":"Rb","name":"Rubidium"},{"z":38,"symbol":"Sr","name":"Strontium"},{"z":39,"symbol":"Y","name":"Yttrium"},{"z":40,"symbol":"Zr","name":"Zirconium"},{"z":41,"symbol":"Nb","name":"Niobium"},{"z":42,"symbol":"Mo","name":"Molybdenum"},{"z":43,"symbol":"Tc","name":"Technetium"},{"z":44,"symbol":"Ru","name":"Ruthenium"},{"z":45,"symbol":"Rh","name":"Rhodium"},{"z":46,"symbol":"Pd","name":"Palladium"},{"z":47,"symbol":"Ag","name":"Silver"},{"z":48,"symbol":"Cd","name":"Cadmium"},{"z":49,"symbol":"In","name":"Indium"},{"z":50,"symbol":"Sn","name":"Tin"},{"z":51,"symbol":"Sb","name":"Antimony"},{"z":52,"symbol":"Te","name":"Tellurium"},{"z":53,"symbol":"I","name":"Iodine"},{"z":54,"symbol":"Xe","name":"Xenon"},{"z":55,"symbol":"Cs","name":"Cesium"},{"z":56,"symbol":"Ba","name":"Barium"},{"z":57,"symbol":"La","name":"Lanthanum"},{"z":58,"symbol":"Ce","name":"Cerium"},{"z":59,"symbol":"Pr","name":"Praseodymium"},{"z":60,"symbol":"Nd","name":"Neodymium"},{"z":61,"symbol":"Pm","name":"Promethium"},{"z":62,"symbol":"Sm","name":"Samarium"},{"z":63,"symbol":"Eu","name":"Europium"},{"z":64,"symbol":"Gd","name":"Gadolinium"},{"z":65,"symbol":"Tb","name":"Terbium"},{"z":66,"symbol":"Dy","name":"Dysprosium"},{"z":67,"symbol":"Ho","name":"Holmium"},{"z":68,"symbol":"Er","name":"Erbium"},{"z":69,"symbol":"Tm","name":"Thulium"},{"z":70,"symbol":"Yb","name":"Ytterbium"},{"z":71,"symbol":"Lu","name":"Lutetium"},{"z":72,"symbol":"Hf","name":"Hafnium"},{"z":73,"symbol":"Ta","name":"Tantalum"},{"z":74,"symbol":"W","name":"Tungsten"},{"z":75,"symbol":"Re","name":"Rhenium"},{"z":76,"symbol":"Os","name":"Osmium"},{"z":77,"symbol":"Ir","name":"Iridium"},{"z":78,"symbol":"Pt","name":"Platinum"},{"z":79,"symbol":"Au","name":"Gold"},{"z":80,"symbol":"Hg","name":"Mercury"},{"z":81,"symbol":"Tl","name":"Thallium"},{"z":82,"symbol":"Pb","name":"Lead"},{"z":83,"symbol":"Bi","name":"Bismuth"},{"z":84,"symbol":"Po","name":"Polonium"},{"z":85,"symbol":"At","name":"Astatine"},{"z":86,"symbol":"Rn","name":"Radon"},{"z":87,"symbol":"Fr","name":"Francium"},{"z":88,"symbol":"Ra","name":"Radium"},{"z":89,"symbol":"Ac","name":"Actinium"},{"z":90,"symbol":"Th","name":"Thorium"},{"z":91,"symbol":"Pa","name":"Protactinium"},{"z":92,"symbol":"U","name":"Uranium"},{"z":93,"symbol":"Np","name":"Neptunium"},{"z":94,"symbol":"Pu","name":"Plutonium"},{"z":95,"symbol":"Am","name":"Americium"},{"z":96,"symbol":"Cm","name":"Curium"},{"z":97,"symbol":"Bk","name":"Berkelium"},{"z":98,"symbol":"Cf","name":"Californium"},{"z":99,"symbol":"Es","name":"Einsteinium"},{"z":100,"symbol":"Fm","name":"Fermium"},{"z":101,"symbol":"Md","name":"Mendelevium"},{"z":102,"symbol":"No","name":"Nobelium"},{"z":103,"symbol":"Lr","name":"Lawrencium"},{"z":104,"symbol":"Rf","name":"Rutherfordium"},{"z":105,"symbol":"Db","name":"Dubnium"},{"z":106,"symbol":"Sg","name":"Seaborgium"},{"z":107,"symbol":"Bh","name":"Bohrium"},{"z":108,"symbol":"Hs","name":"Hassium"},{"z":109,"symbol":"Mt","name":"Meitnerium"},{"z":110,"symbol":"Ds","name":"Darmstadtium"},{"z":111,"symbol":"Rg","name":"Roentgenium"},{"z":112,"symbol":"Cn","name":"Copernicum"},{"z":113,"symbol":"Nh","name":"Nihonium"},{"z":114,"symbol":"Fl","name":"Flerovium"},{"z":115,"symbol":"Mc","name":"Moscovium"},{"z":116,"symbol":"Lv","name":"Livermorium"},{"z":117,"symbol":"Ts","name":"Tennessine"},{"z":118,"symbol":"Og","name":"Oganesson"}],"stableNeutrons":[[],[0,1],[1,2],[3,4],[5],[5,6],[6,7],[7,8],[8,9,10],[10],[10,11,12],[12],[12,13,14],[14],[14,15,16],[16],[16,17,18,20],[18,20],[18,20,22],[20,22],[20,22,23,24,26],[24],[24,25,26,27,28],[28],[28,29,30],[30],[28,30,31,32],[32],[30,32,33,34,36],[34,36],[34,36,37,38],[38,40],[38,40,41,42,44],[42],[40,42,43,44,46],[44,46],[42,44,46,47,48,50],[48],[46,48,49,50],[50],[50,51,52,54],[52],[50,52,53,54,55,56],[],[52,54,55,56,57,58,60],[58],[56,58,59,60,62,64],[60,62],[58,60,62,63,64,66],[64],[62,64,65,66,67,68,69,70,72,74],[70,72],[68,70,72,73,74],[74],[72,74,75,76,77,78],[78],[74,78,79,80,81,82],[82],[78,82],[82],[82,83,85,86,88],[],[82,87,88,90,92],[90],[90,91,92,93,94,96],[94],[90,92,94,95,96,97,98],[98],[94,96,98,99,100,102],[100],[98,100,101,102,103,104,106],[104],[104,105,106,107,108],[108],[108,110,112],[110],[111,112,113,114,116],[114,116],[114,116,117,118,120],[118],[116,118,119,120,121,122,124],[122,124],[124,125,126]],"halfLives":{"0":{"1":613.9,"4":1.75476e-22,"6":null},"1":{"2":388781328,"3":null,"4":8.60826e-23,"5":2.94347e-22,"6":5.06931e-21},"2":{"3":7.04071e-22,"4":0.8067,"5":3.04158e-21,"6":0.1191,"7":null,"8":1.52079e-21},"3":{"1":null,"2":3.70925e-22,"5":0.8399,"6":0.1783,"7":null,"8":0.00875,"9":null},"4":{"2":4.95911e-21,"3":4598208,"4":8.19098e-17,"6":47651000000000,"7":13.76,"8":0.02146,"9":2.7e-21,"10":0.00435,"11":7.86617e-22,"12":5.70297e-22},"5":{"2":5.69585e-22,"3":0.77,"4":8.44885e-19,"7":0.0202,"8":0.01733,"9":0.0125,"10":0.00993,"11":4.56238e-21,"12":0.00508,"13":null,"14":0.00292,"15":9.12475e-22,"16":7.60396e-22},"6":{"2":3.50952e-21,"3":0.1265,"4":19.29,"5":1221.84,"8":179874000000,"9":2.449,"10":0.747,"11":0.193,"12":0.092,"13":0.0463,"14":0.0163,"16":0.0061},"7":{"3":1.82495e-22,"4":5.49684e-22,"5":0.011,"6":597.9,"9":7.13,"10":4.173,"11":0.619,"12":0.336,"13":0.1344,"14":0.084,"15":0.023,"16":0.0141,"17":5.2e-8},"8":{"3":3.50952e-22,"4":6.33663e-21,"5":0.00858,"6":70.606,"7":122.24,"11":26.88,"12":13.51,"13":3.42,"14":2.25,"15":0.097,"16":0.065,"17":null,"18":4.5e-12},"9":{"4":4.51721e-22,"5":5.0136e-22,"6":6.91269e-22,"7":1.14059e-20,"8":64.49,"9":6586.2,"11":11.07,"12":4.158,"13":4.23,"14":2.23,"15":0.39,"16":0.08,"17":0.0082,"18":0.005,"19":4.6e-20,"20":0.0025,"21":null,"22":2.6e-7},"10":{"5":7.73284e-22,"6":5.70297e-21,"7":0.1092,"8":1.672,"9":17.22,"13":37.25,"14":202.8,"15":0.602,"16":0.197,"17":0.0315,"18":0.02,"19":0.015,"20":0.0073,"21":0.0034,"22":0.0035,"23":1.8e-7,"24":6e-8},"11":{"6":null,"7":2.28119e-21,"8":1.14059e-20,"9":0.4479,"10":22.49,"11":82104810,"13":53989.2,"14":59.1,"15":1.07128,"16":0.301,"17":0.0305,"18":0.0441,"19":0.048,"20":0.01735,"21":0.0132,"22":0.008,"23":0.0055,"24":0.0018,"25":1.8e-7,"26":6e-8},"12":{"7":4.00209e-12,"8":0.0904,"9":0.122,"10":3.8755,"11":11.3046,"15":567.48,"16":75294,"17":1.3,"18":0.335,"19":0.236,"20":0.086,"21":0.0905,"22":0.02,"23":0.0113,"24":0.0076,"25":0.008,"26":null,"27":1.8e-7,"28":null},"13":{"8":3.5e-8,"9":0.0911,"10":0.446,"11":2.053,"12":7.183,"13":22626300000000,"15":134.7,"16":393.6,"17":3.62,"18":0.644,"19":0.033,"20":0.0417,"21":0.0563,"22":0.0383,"23":0.09,"24":0.0107,"25":0.009,"26":0.0076,"27":2.6e-7,"28":null,"29":1.7e-7,"30":1.7e-7},"14":{"8":0.029,"9":0.0423,"10":0.14,"11":0.22,"12":2.2453,"13":4.15,"17":9441.6,"18":4954437378,"19":6.11,"20":2.77,"21":0.78,"22":0.45,"23":0.09,"24":0.063,"25":0.0475,"26":0.033,"27":0.02,"28":0.0125,"29":6e-8,"30":3.6e-7},"15":{"10":3e-8,"11":0.0437,"12":0.26,"13":0.2703,"14":4.142,"15":149.88,"17":1232755.2,"18":2190240,"19":12.43,"20":47.3,"21":5.6,"22":2.31,"23":0.64,"24":0.28,"25":0.15,"26":0.101,"27":0.0485,"28":0.0365,"29":0.0185,"30":2e-7,"31":null},"16":{"10":7.9e-8,"11":0.0155,"12":0.125,"13":0.188,"14":1.178,"15":2.5534,"19":7548768,"21":303,"22":10218,"23":11.5,"24":8.8,"25":1.99,"26":1.016,"27":0.265,"28":0.1,"29":0.068,"30":0.05,"32":2e-7},"17":{"12":2e-8,"13":3e-8,"14":0.19,"15":0.298,"16":2.511,"17":1.5266,"19":9508100000000,"21":2233.8,"22":3372,"23":81,"24":38.4,"25":6.8,"26":3.13,"27":0.56,"28":0.413,"29":0.232,"30":0.101,"31":2e-7,"32":1.7e-7,"33":null,"34":null,"35":null},"18":{"12":1e-11,"13":0.0144,"14":0.098,"15":0.173,"16":0.8438,"17":1.7756,"19":3024950.4,"21":8457256161,"23":6576.6,"24":1038222865,"25":322.2,"26":712.2,"27":21.48,"28":8.4,"29":1.23,"30":0.475,"31":0.17,"32":0.106,"33":null,"34":null,"35":6.2e-7},"19":{"14":2.5e-8,"15":2.5e-8,"16":0.178,"17":0.341,"18":1.225,"19":459.06,"21":39383000000000000,"23":44478,"24":80280,"25":1327.8,"26":1068.6,"27":105,"28":17.5,"29":6.8,"30":1.26,"31":0.472,"32":0.365,"33":0.11,"34":0.03,"35":0.01,"36":3.6e-7,"37":6.2e-7},"20":{"14":3.5e-8,"15":0.0257,"16":0.1012,"17":0.1811,"18":0.44376,"